{
  "case_id": "synthetic/event-reporting",
  "model": "deepseek",
  "probe": "planner",
  "score": {
    "hit_rate": 3,
    "contract_closure": 2,
    "actionability": 3,
    "evidence_discipline": 1,
    "false_positive_cost": 4
  },
  "total": 13,
  "matched_known_issues": [
    "保护支付成功页非阻塞。",
    "排除至少一次投递、死信队列和平台化建设。"
  ],
  "missed_known_issues": [
    "最终线上报文结构未形成唯一规范。",
    "event_id 生成责任分散。"
  ],
  "valuable_new_findings": [
    "四个模型中范围控制最好。"
  ],
  "false_positives": [
    "假设旧服务端会忽略实时字段。"
  ],
  "failure_modes": [
    "主契约存在多个字段位置和责任方。",
    "范围克制没有转化为完整可执行契约。"
  ],
  "notes": "角色判断：适合作为 Planner 的范围控制辅助，不适合独立完成跨层协议定稿。",
  "suggested_roles": [],
  "unsuitable_roles": []
}
