{
  "case_id": "synthetic/event-reporting",
  "model": "kimi",
  "probe": "risk",
  "score": {
    "hit_rate": 4,
    "contract_closure": 4,
    "actionability": 4,
    "evidence_discipline": 5,
    "false_positive_cost": 5
  },
  "total": 22,
  "matched_known_issues": [
    "await reportEvent 阻塞支付成功页。",
    "is_realtime 字段位置跨层不一致。",
    "重试和批量回退缺少 event_id 去重保障。",
    "开发环境验收缺少生产指标和故障发现能力。"
  ],
  "missed_known_issues": [
    "没有把同窗口发布和跨版本兼容作为正式 issue。",
    "没有明确指出缺少回滚能力。"
  ],
  "valuable_new_findings": [
    "问题集合精炼，同一根因没有重复拆分。",
    "准确识别降级到批量本身不构成风险。"
  ],
  "false_positives": [],
  "failure_modes": [],
  "notes": "角色判断：Risk 主模型候选，也是 Qwen 的高质量备选。事实纪律和误报控制优秀，但兼容发布与回滚覆盖略弱。",
  "suggested_roles": [
    "risk"
  ],
  "unsuitable_roles": []
}
