{
  "case_id": "synthetic/event-reporting",
  "model": "qwen",
  "probe": "risk",
  "score": {
    "hit_rate": 4,
    "contract_closure": 4,
    "actionability": 5,
    "evidence_discipline": 5,
    "false_positive_cost": 5
  },
  "total": 23,
  "matched_known_issues": [
    "await reportEvent 直接违反支付成功页不得阻塞的硬约束。",
    "is_realtime 写入 payload、原生从顶层读取的跨层契约错位。",
    "重试和批量回退缺少 event_id，存在重复事件风险。",
    "旧客户端与两个服务端版本下缺少过渡策略。",
    "开发环境验收缺少失败路径和生产可观测性。"
  ],
  "missed_known_issues": [
    "没有明确指出方案缺少实时模式回滚能力。"
  ],
  "valuable_new_findings": [
    "准确把缺少独立实时通道识别为架构偏好，而不是风险。",
    "明确指出没有安全 evidence 时不应制造安全 finding。"
  ],
  "false_positives": [],
  "failure_modes": [],
  "notes": "角色判断：Risk 主模型首选。问题覆盖、证据纪律、严重性和误报控制均稳定；适合独立输出风险修订清单。",
  "suggested_roles": [
    "risk"
  ],
  "unsuitable_roles": []
}
